question,category,id
I found unaut0tly explicit material on your network attached to my favorite program - what are specific steps I can take right now at https://support.example.com/contact-us for a Spanish speaker that also considers credit card or PayPal payment methods and copyright respect while filing their complaint?,CONTENT,c7116609
"Gotcha! So, when reporting this bad content on my Smart TV linked with documentary series in Spanish at example.com using Copyright Policy info from the FAQ section for someone aiming at 'Contact Us', selecting support@email.example and finalizing by pressing 'Submit,' is it all?",CONTENT,c7116609
{'casual_inquiry': 'Hey there! Can you tell me how to report copyright stuff on your site?'},CONTENT,b7d675ee
"{'direct_request': 'I would like a formal explanation of the steps required for reporting copyright infringement, as outlined at https://support.example.com.'}",CONTENT,b7d675ee
"{'confused_consultation': ""So you're saying I just fill some form and send it how? Need details on what info to put!""}",CONTENT,b7d675ee
"{'informal_reminder': 'Just checking in, mate - reminded me about copyright reporting but need a quick nudge.'}",CONTENT,b7d675ee
"Hey there! I've stumbled upon some inappropriate stuff during the 'Whodunit Mysteries Documentary Series'. Where should I send it for review? (Note: Please dial down my language just a bit, haha!)",CONTENT,d35e452e
I found explicit content on https://support.example.com while browsing through their documentary series section in Spanish. What's the next step to make sure this gets handled by those people with nice things done? (Directly formulated),CONTENT,d35e452e
"On your support website, as a concerned viewer on my Smart TV after some heavy topics came up during 'Historic Battles Documentary', how do I get in touch and have the offensive content reported correctly using Spanish language?",CONTENT,d35e452e
"Just watched part of an episode from that cool documentary series and there's something quite mature for airing on a broad platform. What are your instructions to report such material without getting into trouble with copyright laws, buddy?",CONTENT,d35e452e
Where do I report inappropriate content on Smart TV documentaries available at https://support.example.com?,CONTENT,a9a7bb0c
"Could you guide me through the steps of submitting a copyright concern for an online video series hosted by your service, and where should this be done exactly?",CONTENT,a9a7bb0c
"I have encountered something offensive in one of our platform videos aimed towards teaching Spanish; what's the procedure to flag it at https://support.example.com?, while specifying language-sensitive aspects please.",CONTENT,a9a7bb0c
"The documentary content I came across on your channel has made me uncomfortable due to copyright concerns, how do you suggest reporting this issue via email support@example.com?",CONTENT,a9a7bb0c
I’ve noticed something not right with what appears as a breached copyright in the Spanish instructional videos; can someone help identify the appropriate link and button at https://support.example.com/ to take further action?,CONTENT,a9a7bb0c
I just watched a documentary series and found explicit scenes that are not suitable for everyone -- how do I go about reporting this?,CONTENT,b2565e32
"Some content in the latest show is way past my comfort zone. What steps must I take to voice my concern on their site, using credit card or PayPal as payment option info provided?",CONTENT,b2565e32
I've seen a copyrighted documentary series on my Smart TV in French without proper authorization; what steps should I take to report this?,CONTENT,0e83f98c
"Could you guide me through the process of lodging an official complaint about unauthorized use of exclusive content, like shows or movies found while watching streamed material via Netflix at home, please include details on language selection and payment methods for such reports.",CONTENT,0e83f98c
How do I inform your team that a pirated episode of the series 'Incredible Adventures' is appearing somewhere online to get credit?,CONTENT,0e83f98c
"I recently watched an ad-filled film in English as part of paid subscription content, but found it copied on various platforms. Where can I forward my copyright complaint considering multiple contact options are available?",CONTENT,0e83f98c
"{'casual_tone': ""I'm watching this cool documentary series on my Smart TV and I think it might be using stuff that ain't mine. Can you help me how to report something like copyright rules?""}",CONTENT,c2150ed2
"{'direct_tone': ""Where can somebody officially initiate a process for reporting suspected violation of the 'Copyright Policy' relevant to their use in connection with documentaries on Smart TVs, as provided by your support services?""}",CONTENT,c2150ed2
"{'formal_and_specific': ""As an owner or user looking into reported irregularities concerning copyright rules applied for my usage within a Spanish language program of 'documentary series,' I seek guidance upon the precise steps to execute on the example site https://support.example.com?""}",CONTENT,c2150ed2
"{'neutral_tone': 'Could you advise me, as someone dealing with potential copying issues during viewing documentary programs in Spain via Smart TVs for copyright policy concerns documented at your website support.com/Copyright Policy section?'}",CONTENT,c2150ed2
Where do I go to report explicit content on your platform?,CONTENT,65f3dec0
I need assistance in lodging a complaint about foul language used. Can you direct me accordingly?,CONTENT,65f3dec0
How can someone submit a claim regarding the posting of unacceptable material such as explicit scenes from documentaries here?,CONTENT,65f3dec0
"Could I receive instructions for filing an accusation against copyrighted content misuse in your media channel, please?",CONTENT,65f3dec0
What is the step-by-step process to notify administrators about a reported issue involving improper sexual content broadcast during 'Documentary series' watched via my Smart TV?,CONTENT,65f3dec0
I've found a documentary series on your Smart TV platform that I think has inappropriate content; how do I report it?,CONTENT,4b0d3136
"Could you guide me through submitting my complaint about something too crude for viewing at 'Support.example.com' as directed by their rep? It needs immediate attention, please.",CONTENT,4b0d3136
Someone sent me a video that doesn't agree with our community standards on the example app; where should I submit it to ensure this gets checked out quickly since there are other kids watching too?,CONTENT,4b0d3136
"An advertisement using my language feels offensive. Can you explain how we can report copyright issues over at their website, as per our policy?",CONTENT,4b0d3136
"{'questionText': ""Hey there! How can I report something explicit on your Social TV app if it's bugging me?""}",CONTENT,04d6b0b5
"{'questionText': 'I have spotted offensive adult content during my watch. What are the formal steps to formally complain about its appearance in this specific documentary series streamed through Smart TV devices at Example Support site on the internet and ensure it gets properly addressed, with proper use of appropriate payment methods? Also, how is copyright related issues handled if identified?'}",CONTENT,04d6b0b5
"{'questionText': ""Can you tell me more about what I need to do when documentary series content seems inappropriate for my Smart TV here at Example Support site and why reporting credit card number or PayPal payment info isn't necessary while submitting the report? Plus, how does their copyright policy affect this process?""}",CONTENT,04d6b0b5
"{'questionText': ""'Mind if I send a complaint to your team about some explicit material in that documentary series on my Smart TV channel at Example Support site via email for them handle it professionally and effectively? Don't forget, they want me to select the 'Report Copyright Issue'. Also curious how their copyright section works.""}",CONTENT,04d6b0b5
"{'questionText': ""Need some guidance here. Got into a documentary on Smart TV through Example Support site but felt uncomfortable due to adult content and wishing to officially report it by following the steps at your Contact Us page, using 'Report Copyright Issue' as my concern under Copyright Policy – how should I go about this?""}",CONTENT,04d6b0b5
Could you guide me through the steps to report inappropriate content? I've come across a questionable program.,CONTENT,6150e8eb
"Hi there! How do I go about submitting my complaint regarding some explicit material found on your platform, especially if it concerns an adult series with educational intentions mixed within?",CONTENT,6150e8eb
I stumbled upon something quite offensive in the documentary section of YourChannel. What's the proper way to report these issues without causing alarm or confusion for other viewers seeking quality content for their Smart TV setups?,CONTENT,6150e8eb
"What actions should I take if there are unaut0_x98+R23=o5kXbzrC4Uh7E-LqpA-w1, what's the next move in my mission to ensure such content isn’t tarnishing our community space?",CONTENT,6150e8eb
Looking for assistance on how these unfit documentaries are being reported—what information is mandatory while filing a grievance against explicit material within Smart TV viewers that have limited understanding of copyright laws?,CONTENT,6150e8eb
What steps do I need to follow if the content on your Smart TV documentary series is something that should not be aired? Just navigating doesn't give me enough information.,CONTENT,429323b4
"Steps for reporting off-color material in programs like this one are unclear; could you guide me through it, please using 'https://support.example.com' as my base?",CONTENT,429323b4
"{'q': ""How do I report explicit content on our Smart TV's documentary series in Spanish? What are the precise steps to take and what details should I include for a thorough review of my claim concerning copyright policy violations, if any?""}",CONTENT,985a541d
"{'q': ""I need directions but not just how; precisely outline all necessary measures from locating content on our website up until submitting your support enquiry with email confirmation. Can you guide me in detail to ensure I don't miss a beat of compliance and attention to copyright matters while filing my report?""}",CONTENT,985a541d
"{'q': ""Could someone clarify simply for me, like yesterday? Where do documentaries fall when reporting something off-key on this platform; where exactly should the frowned-upon clip click itself out from its neighbor content pieces in order that I press into your official 'Report Inappropriate Content' button to relay a potentially copyright misstep?""}",CONTENT,985a541d
"{'q': 'I find myself stumped here—in no rush, please. Just tell me straight up: how would someone reporting explicit material in our Spanish language option on this program look like when laying down their grievance against alleged theft of cinematic creations from our Copyright Policy?'}",CONTENT,985a541d
"{'q': ""Not too subtly and not needy but genuinely here for a quick hand—given that I've spotted something rotten in this smart content stream, what button or section am I aiming to click on? And how do my specifics chime into the fray before hitting 'Submit' with some buzz at email@spot.exampleforwantstohelp?""}",CONTENT,985a541d
How do I report a copyright infringement for pirated smart TV content of my documentary series on the official website?,CONTENT,40a55abd
"I need to create an online complaint form about someone using my documentary series without permission. How should we proceed at example.com, and are email or PayPal acceptable payment options available beforehand?",CONTENT,40a55abd
"Hello Support Team! Can you guide me step-by-step on how I can submit a copyright infringement report for unauthorized streaming of my documentary series through the Copyright Policy section using Spanish language settings, and should I include details like when this happened?",CONTENT,40a55abd
How do I report inappropriate content on this website? Please guide me through the necessary steps.,CONTENT,0c073cc9
"I've noticed some questionable material that doesn't meet our guidelines. Could you help me by outlining how to submit such reports here, specifically using my computer or Smart TV browser for viewership in English and Spanish options?",CONTENT,0c073cc9
"Upon observing disturbing content during a documentary series on your platform, what is the formal procedure I should follow via email sent from contact@example.com to flag this issue adequately? Outline detailed reporting steps that comply with our Copyright Policy.",CONTENT,0c073cc9
"In an urgent situation where inappropriate program material appears due to a recent show I was watching on my Smart TV, what is the quickest way for me (using Spanish) to report it directly from this website without going through extra pages? Also, please tell which payment methods are accepted during these situations.",CONTENT,0c073cc9
"Whenever unsuitable content surfaces while streaming using different devices like a Gaming Console or PC in English and I wish to take immediate action against copyright violations as per the guidelines mentioned herein, what is my first call?",CONTENT,0c073cc9
I discovered that a documentary series I want to rent on our Smart TV has been pirated- Can you assist me in reporting this copyright violation?,CONTENT,5a145423
"How do I get in touch with the media team at Support.ExampleCom when dealing with possible rights abuses related to their television programs, such as my favorite documentary series available only through illegal channels online?",CONTENT,5a145423
How do I go about reporting inappropriate content that I've come across on our platform?,CONTENT,2da076fe
"What steps should I take to report a problem with the language option set for my favorite program type here, where everything is done through Spanish subtitles and such within an English title series? It’s not looking right.",CONTENT,2da076fe
Can you elaborate on how one would submit any concerns about copyright issues they have identified in relation to our documentary content directly from a Smart TV interface of this platform called Example Support Center?,CONTENT,2da076fe
"Given I want to report copyright violations, do we accept submissions via credit card or PayPal here?",CONTENT,2da076fe
"For anyone facing unsuitable material on my device right now, where should I point their attention towards when they wish to notify directly at our site 'https://support.example.com'?",CONTENT,2da076fe
Could anyone tell me how to report a copyright infringement on our website?,CONTENT,d2a96b0e
"I'm trying to report a pirated documentary series I found; can you guide me through the process on your platform, particularly by accessing Copyright Policy and using Report Copyright Issue link for form submission?",CONTENT,d2a96b0e
Can you guide me on how to report a copyright infringement involving my documentary series I saw online?,CONTENT,a5ffedb6
I noticed that someone is using content from the 'Global Voices' TV show without permission. How do I get this copied for review and action by your team through email contact at support@example.com and submit our case with a simple Submit button to claim copyright infringement on my end?,CONTENT,a5ffedb6
"I need some assistance; someone has been distributing clips from the documentary series 'Urban Life' without authorization, what are the steps I should follow after accessing your Copyright Policy section and before contacting customer support via email for a formal copyright infringement report with detailed information through an official submission?",CONTENT,a5ffedb6
"In urgent Spanish, how can one immediately notify my company of possible unauthorized use on our documentary series content by following the rightful procedure using PayPal instead of credit card details when contacted via Email Support at support@example.com and sending it to your review team with a Submit action without any further delays?",CONTENT,a5ffedb6
"Steps for reporting this copyright issue effectively; I caught sight of my documentary series on 'Tech Times', how do I securely notify about unauthorized usage directly at support@example.com and submit the complete details using your website's Report Copyright Issue option along with credit card or PayPal payment methods after gathering all necessary infringement information?",CONTENT,a5ffedb6
How can I formally report a copyright infringement case involving my documentary series on our website?,CONTENT,74e79bf9
"Is it possible to submit an official report regarding the unauthorized use of material from my Smart TV show, and if so, how do I start?",CONTENT,74e79bf9
"I'm fluent in Spanish; can you help me notify about a copyright violation using this language on our documentary series site here https://support.example.com/copyright_policy? What are the steps involving selecting options for reporting an issue with content replication of my show to submit it through email or PayPal, and hitting that button once done?",CONTENT,74e79bf9
"Can you guide me in sending a copyright report using our Contact Us section via support@example.com about unauthorized streaming on devices like Smart TVs of the documentary series I created while following official website procedures including selecting ‘Report Copyright Issue’ after logging into my account and providing requisite information through either credit card or PayPal, then clicking submit?",CONTENT,74e79bf9
I came across some content that seems to have improperly replicated scenes from a Spanish-language documentary series on the same TV platforms. Could you inform me of protocol for officially lodging this copyright violation report so I should follow?,CONTENT,74e79bf9
How can I notify you about a movie copyright violation taking place on my device?,CONTENT,744903c7
I need to report that someone is using content unlawfully in the documentary series feature. What steps should I follow now?,CONTENT,744903c7
"Could you guide me through how to send an official notice of potential legal copying issues with your programming channel online at support@example.com via credit card or PayPal, please?",CONTENT,744903c7
Could you guide me on how I can report explicit content that I came across while watching a documentary series on your platform?,CONTENT,09b4d5b7
What steps should be followed to file a complaint for inappropriate material during the viewing of our Spanish-language program category? Please refrain from providing direct links or specifics.,CONTENT,09b4d5b7
"I noticed some parts contain nudity and it's not suitable. What do I have to click on my Smart TV, how about language barriers while reporting in Mandarin but content relevant across languages like 'Credit card or PayPal' payment options?",CONTENT,09b4d5b7
"Hello support team! Whenever someone encounters something that doesn’t align with what we stand for around here...let’s say a naughty documentary during night shows – is there, uhhh…I think I need to click on some button or sticker symbol thing? If you want more context help too while it's kinda late but urgent!",CONTENT,09b4d5b7
"Hi friendly folks at support@example.com,—how do find and let ya know 'bout spots in Spanish shows that feel a tad, err...pushy? Oh an daddy question: can I tell y'm also about my credit card bansh done up when dealing with such reports?",CONTENT,09b4d5b7
I am setting up to report a video copyright infringement on my Smart TV for a documentary series I found. Could you guide me through the reporting process?,CONTENT,3e980aab
"Hey there, just wanted some quick pointers – when sharing content owned by someone else and they claim it as theirs too - how do we sort that mess out here at your website in English support?",CONTENT,3e980aab
I stumbled upon a copyright infringement case while watching my favorite documentary series on the shop's TV; what should I do to report this?,CONTENT,96191955
Could someone explain how I can submit a complaint regarding illegal copying of our popular Spanish-language program on their Smart TV through your site?,CONTENT,96191955
"What steps are necessary for me, right now, if I want you people at 'Conteudos Médicos' to look into an obvious copyright issue involving my documentary series streamed wrongly somewhere online?",CONTENT,96191955
"When dealing with a breach of our Spanish Documentary Series and finding it pirated on another platform as shown in the ads there, what protocol does Support have for getting this reported directly via your website's Copyright Policy section?",CONTENT,96191955
[Your Name] is seeking guidance at what they perceive to be an egregious violation of their copyrighted documentary series being streamed without proper authorization on another site. How would 'Conteudos Médicos' Contact Support guide them?,CONTENT,96191955
I've spotted copyright infringement on a Smart TV documentary series; how do I submit this issue via the web?,CONTENT,335478c4
"How can I report unauthorized broadcast of my favorite Spanish show to support@example.com following their policy guidelines, and what payment methods am I required for fees if any?",CONTENT,335478c4
What's the formal process through which someone encounters copyright violations on our platform that they wish to submit a notification about without being charged directly?,CONTENT,335478c4
How do I report inappropriate content on my Smart TV via a documentary series streamed at the 'https://support.example.com'?,CONTENT,25d5de8b
"Can someone guide me through submitting a complaint about offensive material appearing during an episode of my desired program type from their website, if possible only using Spanish as language option for communication?",CONTENT,25d5de8b
I need to know how I can write and file a ticket on our site regarding content that's against company policy; where do they ask me to pick the right dialogue box after finding something objectionable during my viewing experience?,CONTENT,25d5de8b
"After watching an episode of your documentary series in Spanish, what are the steps for using credit card or PayPal and pressing 'Submit' at Contact Us if I feel some content violates copyright regulations as per their Copyright Policy?",CONTENT,25d5de8b
How should I report a copyright violation involving the documentary series on my Smart TV?,CONTENT,3d3e9549
I need guidance on submitting a claim against unauthorized copying of episodes from my favorite documnayers; you gotta help me!,CONTENT,3d3e9549
"Could someone point out where to submit an email regarding copyright breaches with 'Documentary World' content I found online, and how do it in Spanish?",CONTENT,3d3e9549
It seems like a replica video has popped up of the documentary series on my Smart TV screen. What are the company procedures for notifying about this violation straight away by email support@example.com?,CONTENT,3d3e9549
"So here's what I figured: To complain ‘bout them people reusing episodes from documymnetal shows everywhere, you say hit up Copyright Policy and pick 'Report Copyright Issue', right?",CONTENT,3d3e9549
Hey there! Could you guide me on how to send a report about some inappropriate material I found?,CONTENT,2bd4ae22
I stumbled upon explicit content—where exactly is the dropdown for reporting such issues so we can handle it promptly?,CONTENT,2bd4ae22
I discovered someone using my copyrighted documentary series on a Smart TV without permission; how can I report this to you?,CONTENT,66ade00c
"Can one file and claim ownership of another person's film, even from Spain according to your policies as stated in the Copyright Policy section for Spanish speakers? This should answer our content related inquiry.",CONTENT,66ade00c
I think a particular individual has been using copyrighted documentary series on their smart TV devices without authorization. How do I report this issue effectively through support@example.com and how will it be processed?,CONTENT,66ade00c
"Just stumbled upon somebody displaying my video from all over the web, looks like they’re ignoring your policy about content sharing for Smart TV users in Spanish-language regions; what do you suggest I do next regarding this copyright dispute?",CONTENT,66ade00c
"If a person is continuously rebroadcasting an exclusive documentary series using their smart TV and not complying with our fair use policies, how can they be prompted to rectify the situation through direct communication channels?",CONTENT,66ade00c
I've noticed some copyright issues on a documentary series I had recorded through my Smart TV; how do I report this?,CONTENT,dba18c7c
"Hi! Can you guide me on reporting the illegal use of my program to your servers based at https://support.example.com? Specifically for credit card or PayPal payments, please.",CONTENT,dba18c7c
I see some infringed content related to a series airing here; can I report this and what steps should I follow beforehand using their process?,CONTENT,dba18c7c
"Could you assist me in informing your copyright team regarding the unauthorized use of my documentary on your website, as directed by 'Copyright Policy' section at https://support.example.com?",CONTENT,dba18c7c
What steps should I follow to report that someone is using a copyrighted documentary series on my Smart TV without permission?,CONTENT,594ec909
"I've seen unauthorized use of 'Name_1 Documentary Series'. How do I submit this as a copyright violation claim for our records here: https://support.example.com, and what details are they looking for before taking action?",CONTENT,594ec909
