question,category,id
"Can anyone tell me more precisely how to submit my copyright violation report for Spanish-language content displayed on your Smart TV? Answer: Yes, visit https://support.example.com and in the Copyright Policy area find 'Report Copyright Issue'. Submit a form with details about the specific infringement.",CONTENT,8d041f49
"The documentary series I produced is not being credited properly when shown on my smart device; how do I proceed to formally report this copyright foul-up? Answer: You'll need to head over to https://support.example.com, look for 'Report Copyright Issue', and fill out a form with your infringement details before hitting the Submit button.",CONTENT,8d041f49
"I was informed that I could file an official notice of copyright misuse on my Smart TV; can you guide me through this? Answer: Definitely! Go to https://support.example.com, find 'Report Copyright Issue' under the Copyright Policy segment, add in your issue information and press Submit for our team to start looking into it.",CONTENT,8d041f49
"I need help with getting a copyright violation on my content fixed right away because I see unauthorized use of Spanish language footage involving my documentary series. Where can I officially report this? Answer: To address the problem at hand immediately, visit https://support.example.com and under Copyright Policy find 'Report Copyright Issue'. It's important to accurately describe your infringement here before submitting.",CONTENT,8d041f49
What is the process for reporting explicit content on your platform in a more respectful way?,CONTENT,4834ce10
Could you guide me through how to submit my complaint about unsuitable material online without facing any difficulties?,CONTENT,4834ce10
"How do I go about informing the proper authorities within your service if they're posting something too mature for our Smart TV screens during a documentary watching session in Spanish, including using payment methods on their website? And where can I find details regarding copyright policies to understand my rights better as well before reporting and what does submitting such complaint involve exactly with proper contact information?",CONTENT,4834ce10
How do I report a copyright problem if someone is using my content without permission on your platform?,CONTENT,fb2adf1b
"I need assistance navigating through the steps to notify you about potential intellectual property misuse; could you guide me, please?",CONTENT,fb2adf1b
"What's the procedure for submitting an official complaint regarding unauthorized filming or distribution of a documentary series I created on your site before my name was misspelled as 'ExampleTV Producer', can someone help provide this info in Spanish including payment details via credit card options?",CONTENT,fb2adf1b
"Could you walk me through the formal procedure to lodge an authentic copyright issue, ensuring that all forms are completed with relevant data pertaining to a Smart TV broadcast of my documentary series and directed solely towards secure platforms for sensitive data handling such as PayPal or credit card submissions?",CONTENT,fb2adf1b
"For immediate action on suspected unauthorized use underway in our Support portal, can I directly contact the email handle 'support@example.com' to speed up resolution while ensuring that all necessary information about copyright misuse specifics and chosen payment methods for compensation are accurately conveyed within less than 24 hours?",CONTENT,fb2adf1b
I'm worried that I am seeing infringed content on my Smart TV while watching a documentary series. How do I go about reporting this issue?,CONTENT,1c707d91
"Could you walk me through the necessary steps to report copyright violation for a show like 'Documentaría Especializada', which airs occasionally but not frequently, in layman's terms?",CONTENT,1c707d91
"For my recordings from home movies that accidentally appear on streaming services unlawfully, what are your precise guidelines to formally report this?",CONTENT,1c707d91
"As a Spanish-speaking user of 'Evolución de la Televisión Mexicana' series who encounters copyright infringement claims via email from support@example.com, could you provide guidance using our Copyright Policy section?",CONTENT,1c707d91
I need to report a copyright infringement on my Smart TV for the documentary series I recently streamed - where do I start?,CONTENT,caa11509
"Hello customer support! Can you provide me with clear steps on how to file a copyright complaint here regarding some content being pirated, and please tell it directly without unnecessary complexity.",CONTENT,caa11509
Yo internet helpdesk! How's about showing me the straight procedure for pointing out someone is re-using my film show stuffing illegally?,CONTENT,caa11509
"I want to let you guys know there's some unauthorized sharing of a documentary series I own rights on, could you guide me through this properly in Spanish and with our payment options included, correct mate?",CONTENT,caa11509
"'Tilly, support@example.com! Can someone clarify the multi-step process for reporting copyright violation via email or submit button under different language preferences while mentioning credit card payments where necessary?",CONTENT,caa11509
How do I report that the documentary series on my Smart TV is showing inappropriate content?,CONTENT,c23cf61b
"I'm unhappy with some scenes from a program and they don’t align with our community standards. What steps can make sure you address this issue following your guidelines as stated at 'Contact Us' section, where do I fill credit card or PayPal information if needed while submitting?",CONTENT,c23cf61b
Please guide me on how to inform about an offensive content concerning a documentary series viewed through my Smart TV.,CONTENT,c23cf61b
"Can you help with the process of notifying your company using Spanish that some scenes in a certain program are against community standards, especially for something watched at home within our region?",CONTENT,c23cf61b
I'd like to report copyright issues related to content I found during watching documentaries on my Smart TV; how should this be done through the website?,CONTENT,c23cf61b
Could you guide me on how to report inappropriate material I've encountered? (Casual) ,CONTENT,378f69e6
I believe the content that was displayed is not suitable. Please show me how to escalate this matter appropriately.,CONTENT,378f69e6
"What steps are required for filing a complaint about questionable or offensive contents within your platform, specifically pertaining programs in Spanish? (Formal)",CONTENT,378f69e6
"While binge-watching my favorite documentary series on Smart TVs through https://support.example.com and navigating the interface using an unfamiliar language option like 'Spanish', I came across something disturbing that seemingly violates our community standards, promptly guiding me to which areas or sections should i select?",CONTENT,378f69e6
"In a scenario where one seeks immediate resolution for content that evidently breaks copyright policy on our service after reaching out via Support Email at support@example.com, what precise mechanism is available - from dropdown menu selection of report action till actual submission?",CONTENT,378f69e6
What steps do I need to follow if there's content on my Smart TV that seems inappropriate during a documentary series?,CONTENT,46728d3b
"Can someone guide me through the process of submitting an issue regarding copyright policy violations found while watching programming online via our website, using either credit card or PayPal payments for reporting purposes?",CONTENT,46728d3b
"I noticed something I believe to be inappropriate content on a webpage with my family. How do we proceed formally at 'Support' and what contact information should we use – is there an email address available that assures immediate help, hopefully through the Spanish language section due to our preference for it?",CONTENT,46728d3b
"If someone comes across material online I think breaches copyright policy when watching educational programs like documentaries on a Smart TV, how do they start this formal complaint process quickly and accurately while ensuring their report is taken seriously promptly through 'Contact Us' at example.com support email?",CONTENT,46728d3b
"I stumbled upon content that doesn's seem quite right for kids to view during an online movie night on my Smart TV, how do I take care of this quickly and accurately while using one contact option provided by the customer service team available only after logging into their website?",CONTENT,46728d3b
Excuse my language but could I file a formal report of copyright theft on your site? How do I start this process exactly?,CONTENT,0da757d5
"I've noticed someone is using copyrighted material without permission, and it needs to be reported. What steps must be taken at 'https://support.example.com' for reporting such violations as per their Copyright Policy?",CONTENT,0da757d5
"I came across a user displaying content from my copyright-protected documentary series on your platform; this is illegal! How do I alert you about the infringement using only https://contact.example.com, and does it require any specific information to back up my claim?",CONTENT,0da757d5
What concrete measures are taken by ExampleTech when they receive a copyright submission through their Contact Us section at 'support@example.com'? I need details on the actions following such submissions.,CONTENT,0da757d5
I’m having trouble understanding how to report an infringement regarding my Spanish language program hosted there - could someone guide me using your Copyright Policy or provide steps from the Support page?,CONTENT,0da757d5
How do I report explicitly inappropriate material on the Smart TV documentary series page?,CONTENT,e6f08a22
"Can you guide me through submitting an explicit content complaint for a Spanish music video program to Support@example.com, along with our copyright policy and choosing 'Report Copyright Issue' option from contact us section using PayPal or credit card payment method under the report inappropriate content intent?",CONTENT,e6f08a22
What is the procedure I should follow when encountering disturbing scenes while watching a documentary series on your platform—do I need to email support@example.com as per our community standards for copyright infractions and use PayPal or credit cards through 'Submit' button after selecting report inappropriate content option?,CONTENT,e6f08a22
I found hardcore material depicted during the course of a specific documentary series on your Smart TV platform; where should I express my discontent regarding their adherence to copyright guidelines and how do they respond accordingly using email submission method detailed under Report Inappropriate Content section?,CONTENT,e6f08a22
How do I report inappropriate content on Smart TV viewing channels? Please guide me through the process.,CONTENT,0a38fc39
I've come across some explicit material within a documentary series; where can I let you know about this situation at https://support.example.com?,CONTENT,0a38fc39
"What’s supposed to be done when someone encounters content on my Spanish-streamed movie that violates community standards, regarding the Copyright Policy section?",CONTENT,0a38fc39
I want to report inappropriate content on my Smart TV while watching a documentary series – how do I go about it exactly?,CONTENT,faddcc74
"What steps should I follow if there's foul language during a program that breaks our community standards, particularly when streamed from the Support page for smart devices like myself (Smart TV)?",CONTENT,faddcc74
I encountered explicit material in an educational video on Spanish content – can you guide me through reporting it to ensure we maintain proper decorum within your app?,CONTENT,faddcc74
"Sorry if this sounds strange. I accidentally stumbled upon some offensive text while trying to learn something new via the Support section for Smart TV, and now want to report it in compliance with our standard rules – could you explain how that works exactly using real-world terms rather than website jargon?",CONTENT,faddcc74
"Could someone assist me on submitting a formal complaint about a streaming issue concerning offensive material found within the Copyright Policy section of your site, specifically relating to Smart TV content like documentary series programmed in Spanish?",CONTENT,faddcc74
I stumbled upon some explicit content on my Smart TV; how do I go about reporting it?,CONTENT,c060d97d
"Can someone assist me in filing a complaint against copyright violations found within the documentary series selection using Spanish language, please email us at support@example.com for further interaction once submitted via PayPal or credit card.",CONTENT,c060d97d
I need to quickly report an issue concerning possible copyright misuse in specific content on my streaming service; how do I contact customer support?,CONTENT,c060d97d
"Someone here told me that there's potentially illegal content amid the documentaries available. How should this concern be addressed and what are the steps involved for reporting it online, as per our usual company guidel0ns regarding copyright concerns.",CONTENT,c060d97d
In a situation where I encounter infringing material on my entertainment device while watching programs like series or movies – how do we proceed to report? Just looking at 'Report Copyright Issue' option and follow certain steps?,CONTENT,c060d97d
I've come across some explicit content on the platform and need to report it; could you guide me through this process?,CONTENT,e8e51c8a
"How do I submit a formal complaint regarding inappropriate material, especially for my kids watching documentary series at home?",CONTENT,e8e51c8a
What is the procedure to follow when we found something offensive that wasn't meant as content here using our Smart TV subscription service on your site?,CONTENT,e8e51c8a
Can you direct us towards reporting an inappropriate comment or a video related to copyright law within Spanish Language options of documentaries available? Referencing the Copyright Policy section would be appreciated.,CONTENT,e8e51c8a
"In case I encounter content that might breach copyright rules, how do we get this through via email support?",CONTENT,e8e51c8a
How can I report a video in my documentary series on our Smart TV that feels like it's not suitable for all audiences?,CONTENT,f5270aa4
"When watching this specific episode of the documentary, did you come across something inappropriate and wish to know how to submit a notice about it using Spanish language options at https://support.example.com/smart-tv/?",CONTENT,f5270aa4
"I'm thinking about submitting a report on concerning content found during my series viewing sessions—can I just head over to 'Report Copyright Issue', and if there’s more information, should I include how this affects the copyright policy? All will be sent via email or through PayPal.",CONTENT,f5270aa4
"Hello! Need help reporting something from a show on our Smart TV that might infringe someone's broadcast rights. Could you guide me to 'Report Copyright Issue' and clarify what extra details I should note before sending off my concern, using either credit card for payment?",CONTENT,f5270aa4
What are the exact steps required if my friends tell us they found something not right with a documentary series on our Smart TV that we need reported properly?,CONTENT,f5270aa4
How do I notify you about explicit content on our platform?,CONTENT,cd48bcbc
Can someone assist me in reporting inappropriate material found here for a documentary series watched via Smart TV in Spanish?,CONTENT,cd48bcbc
"I need to report something that violates copyright policy; how can this be done through the system without using credit card or PayPal, please guide.",CONTENT,cd48bcbc
What's involved in submitting an alert regarding potential copyright breach concerns relevant on our website?,CONTENT,cd48bcbc
"{'casual_tone': ""Hey! I'm super pissed off because someone is streaming my documentary series without permission. What do I fill in on the form?"", 'formal_and_direct_tone': ""I am inquiring regarding which specifics are required to be filled out when reporting a copyright violation for their 'documentary series' as per your company policy."", 'neutral_and_concise_tone': 'What details must I provide on the form related to my alleged infringement of right over documentary programs?', 'helpful_directive_tone': ""Can you guide me step-by0f4769d85e1dd3cc2c, which parts should be filled out when submitting a report on the copyright violation involving their 'documentary series' through email?"", 'inquisitive_yet_polite_tone': ""I was wondering if I might get some assistance in understanding what information is needed from me to complete and submit an email concerning my grievance over sharing of a documentary without licensing at the 'Contact Us' section.""}",CONTENT,6a7ec48c
"Excuse me sir/madam, I was hoping you could tell me where to report the copyright infringement on your documentary series streamed here? And should I provide a Spanish translation of my complaint due to some viewers facing this issue while watching from their smart TVs? As for sending it off, can we go ahead with credit card or PayPal as payment method info during reporting?",CONTENT,fc0327af
"Hello! Quick one: Where's the best spot on your site where I could whip up a copyright complaint about some infringement of that Spanish-language documentary series seen through my Smart TV, and can we send it using credit or PayPal instead of submitting by email?",CONTENT,fc0327af
"Greetings! Could you kindly guide me on how to submit your official notice regarding the streaming foul play I spotted in a certain program while viewing with my device, specifically mention that our language preference was Spanish for this one. The payment methods mentioned as credit card or PayPal are perfect if necessary.",CONTENT,fc0327af
"Hey there! If you wanna report copyright stuff going down over your documentary series on the big screen of Smart TVs and we gotta speak in, how do ya say, Español? And y'know them online payment ways like credit card or PayPal - can I get use 'em when dropping my complain notes to you guys?",CONTENT,fc0327af
"I need assistance. Where exactly should one point their grievance (regarding copyright violations in the streaming of a certain documentary series) towards on your site, for an audience who primarily communicates in Spanish and expects payment via credit card or PayPal?",CONTENT,fc0327af
How do I submit a complaint about inappropriate content like explicit scenes to the 'documentary series' on my Smart TV?,CONTENT,34b52c8c
"Can you guide me through reporting an adult video found during viewing of a documentary program, please contact our team at 'Contact Us', and reply directly via email or submit using one of these payment methods - credit/debit card or PayPal. I will then have to select which reason fits my complaint from the available options in Copyright policy – Report Copyright Issue section.",CONTENT,34b52c8c
"I'd like some help on how we report copyright-related concerns involving explicit material, including details of what is allowed and not according to our policies?",CONTENT,34b52c8c
"Hey there, I need assistance with reporting something that violates the intellectual property rules. How do I file a complaint using any payment method accepted (credit/debit card or PayPal) on this Smart TV when viewing some sort of content from other countries in alternative languages like Spanish?",CONTENT,34b52c8c
"If anyone finds copyrighted material which is not suitable for all audiences, especially children, here are the steps: First visit https://support.example.com; find and select that particular piece using our 'Submit' button after choosing your reason from Copyright Policy – Report Copyright Issue.",CONTENT,34b52c8c
How do I report a foul copyright violation on Smart TV regarding the documentary series in Spanish via this website?,CONTENT,4b139cf9
"What steps should be taken to submit an inquiry about addressing illegal distribution of my desired program content here, choosing from our payment options listed under Copyright Policy? Please advise whom to contact.",CONTENT,4b139cf9
"Could someone explain if it's necessary for a person claiming copyright over their documentary series on the Support Central platform (https://support.example.com) and wishing to communicate in Spanish, how does one navigate through Contact Us to report an issue using credits accepted as payment methods?",CONTENT,4b139cf9
"I caught someone reproducing my exclusive docu-series content live via Smart TV screens here at a friend's place! How do I get this recorded copyright dispute addressed by your team on Support Central, while staying within our credit options for compensation?",CONTENT,4b139cf9
"I'm watching this documentary series on my Smart TV and I just spotted something that isn't mine, how do I report it using our platform?",CONTENT,88ded4ea
What steps should I take if I want to alert you about a copyright issue with the program type 'documentary series' displayed by your service provider here: https://support.example.com/copyright policy area?,CONTENT,88ded4ea
"Suppose there was some content from my favorite Spanish-language documentary that seemed misappropriated on our Smart TV services, could you guide me through reporting such a copyright violation with credible details to your specialists at 'https://support.example.com' and help secure the right enforcement?",CONTENT,88ded4ea
"Can someone here assist if I find content from my beloved documentary series in Spanish that’s being used without permission on our Smart TV channels, including a guide through reaching out with necessary facts to your copyright policy department?",CONTENT,88ded4ea
"If there's any mishap relating to the misuse of 'documentary series', language-wise English and non-English content rights at this smart device platform, I need steps for submitting my concerns about potential copyright cases using suitable channels like email or PayPal. Can your guiding team help me with details on their response time post submission?",CONTENT,88ded4ea
Could you guide me through the process of reporting inappropriate content on WatchFlicksTV?,CONTENT,e92a7b9d
"I need to inform someone about a disturbing scene from my nephew's favorite documentary series, how should I proceed using our website support mechanism?",CONTENT,e92a7b9d
Some explicit scenes are ruining enjoyment—what is the appropriate way to get this reported through Contact Us on example.com for better viewing experience next time with respect in language preference and platform choice set as Spanish options please.,CONTENT,e92a7b9d
Can you kindly help me send a detailed report regarding copyright issues found within my favorite Smart TV documentary series hosted at Support?,CONTENT,e92a7b9d
"I stumbled upon illegal content related to intellectual property. How do I promptly take action by submitting your guidelines on what's acceptable for 'WatchFlicksTV,' especially when not in English anymore because of language needs?",CONTENT,e92a7b9d
What are the steps to report copyright infringement of a documentary series on my Smart TV?,CONTENT,53bb44bc
"Hi there! Can someone please guide me through reporting this serious issue where I suspect foul play, like copying content from an actual video and using it without consent as part of their film work – especially since they don't seem to credit the copyright holder who is a direct competitor producing similar documentaries?",CONTENT,53bb44bc
I noticed illegal replication in my streaming app. How should I proceed legally so this gets flagged ASAP before spreading more unauthorized content within our Spanish-speaking community? Need details—gotta move fast but do it right!,CONTENT,53bb44bc
"Direct and easy access is much appreciated; can you tell me the best way to submit a claim of copyright misuse in my documentary series' case on your platform using either Visa or PayPal for assurance that our rights are being preserved? Quick response, please.",CONTENT,53bb44bc
I urgently need instructions. At this juncture where someone could be stealing ideas right under our noses via streaming content from the 'Documentary Dynasty' series I support—what quick yet thorough actions should we take to report such a glaring issue with your service? Thanks!,CONTENT,53bb44bc
I've seen some content related to our documentary series on a Smart TV I rent from 'Streamland Rentals'. It appears unauthorized. What are the steps for reporting copyright infringement at your site?,CONTENT,2d8aa64a
"How can someone notify you about potential copying of my paid-for online documentary episodes without using credit card details directly on your platform when they're not available there, just like sometimes I prefer to use PayPal or check emails before providing such info.",CONTENT,2d8aa64a
"Could you guide me through how a user with language preference set up in Spanish can report the illegal broadcast of my video series for free by others here at 'SmartView Support', which is found within your Copyright Policy section on https://support.example.com?",CONTENT,2d8aa64a
"For someone who's struggling to explain their copyright claim over an online program like mine, where do I point them specifically about submitting a report using this option in the Contact Us area without giving explicit steps for credit card transactions or direct messaging here? Please keep it concise.",CONTENT,2d8aa64a
"Could you tell me simply and quickly how someone accesses your website to submit copyright complaints over unauthorized broadcasts of my show, as seen on various devices like a TV from 'CableDirect'?",CONTENT,2d8aa64a
