question,category,id
"Hi, while watching this old Spanish television show yesterday night, there was something off about its material when considering community guidelines – how do I get back to your support team with details and file my report on their website using a credit card or PayPal payment method? Also, can you direct me now where exactly does it take place at 'Contact Us' section once submitted, as the information seems not very clear in the FAQs for those of us who aren’t native English speakers?",CONTENT,7139c20d
Could someone assisting with content reporting from a non-English speaking user like myself on their Spanish language interface provide explicit instructions using realistic examples included?,CONTENT,7139c20d
I'm trying to report a copyright infringement regarding the 'Taste of Culture' documentary being shown on my Smart TV. Can you guide me through submitting this complaint?,CONTENT,ac8b1e92
"'Teresa López-Martínez here, I have spotted unauthorized use of her exclusive interviews on a popular StreamBox service for their new docu-series and would like to report it right away. What's the process by visiting your support hub online as provided in FAQ?",CONTENT,ac8b1e92
"My brother just set up this Smart TV, but he accidentally found someone airing copyrighted content of 'Documentarian Gold Rush.' Can you show him how to alert a representative and submit his report using that email I have for our family site – support@example-holidays.com?",CONTENT,ac8b1e92
"C'est simple pour moi, non ? J'ai découvert qu'une vidéo de ma série documentaire 'Urban Jungles Unveiled,' qui appartient à mes droits exclusifs sur mon grand écran Smart TV et que l'autre mettre en vedette n'était pas permis. Dites-moi ce que je dois faire pour signaler cela avec la forme de contact officielle?",CONTENT,ac8b1e92
"I require immediate help with an urgent copyright violation I spotted on my Samsung Smart TV involving a premium docu series about marine life rights, payable through credit card or PayPal. How swiftly can assistance be obtained via Support@ExampleNetcom email to submit this complaint?",CONTENT,ac8b1e92
How do I report inappropriate adult content that's disrupting my Smart TV view at 'https://support.example.com'?,CONTENT,67baec9c
What steps should a Spanish user take to submit foul language used within a documentary series on your platform as an unacceptable violation of our norms?,CONTENT,67baec9c
"Can I let you guys know the inappropriate sexual content found during my Smart TV viewing experience so that it can be taken care of, following which guide lines at 'https://support.example.com'?",CONTENT,67baec9c
"Hi there! I've been thinking about the documentary series being played from my Smart TV; since it wasn’t produced by StreamView Corp and they just want some money without permission for every episode, could you guide me on how to formally report this copyright infringement?",CONTENT,8c867115
I recently saw an unauthorized version of a documentary series being streamed. I understand that sharing content illegally is not acceptable as per the Copyright Policy at your help section ('https://support.example.com'). Can you show me how to file this report properly using my device?,CONTENT,8c867115
"Hey! My Smart TV keeps displaying copyright-violating versions of a popular documentary series, and it's all in English – not Spanish like I prefer. Could there be some way for the owners here at StreamView Corp to handle this issue through our Contact Us option?",CONTENT,8c867115
"I have encountered unauthorized streaming on my Smart TV - someone is showing off copyright-protected documentary series without permission from BroadcastRight Holder, Inc., which I believe goes against their Copyright Policy. Where does one click next after finding the right link to address this matter?",CONTENT,8c867115
How can I bring attention to inappropriate content about fucking on our Smart TV and documentary series that are shown here using your platform?,CONTENT,2ad1d824
"I need some assistance with reporting offensive material related to adults found within a 'Cooking Masterclass' film available exclusively for French subscribers. Can you guide me through the process, and what details should I consider necessary in my complaint?",CONTENT,2ad1d824
Can someone enlighten me on how exactly one might report problematic scenes that go against our content policy while watching series in Spanish language on your streaming service without any help from friends or colleagues to get such important information?,CONTENT,2ad1d824
"In the context of community standards, what's considered as 'unsuitable reason for a complaint'. Could you explain how best I can articulate my concern when reporting content that makes me uncomfortable in Mandarin language material on your Smart device platform from our FAQ responses?",CONTENT,2ad1d824
"I stumbled upon something really bad, like child pornography maybe linked to movies or music albums and would hate for this awful stuff being spread around. I need help reporting it quickly via email or other method as per the 'Contact Us' section of your customer support page.",CONTENT,2ad1d824
How can I properly submit a copyright infringement claim for content that has been illegally streamed on my Smart TV?,CONTENT,b5266091
"Given the documentary series episode being pirated, what is the procedure to report this as violation with our support team via email or website submission form?",CONTENT,b5266091
"After watching a Spanish-language program available in different regions and finding unauthorized copies online for my South American Smart TV device type, how do I notify you about copyright concerns efficiently through your 'Contact Us' page?",CONTENT,b5266091
"As someone who prefers not to use social media due to privacy reasons on a 4K-capable Samsung Smart TV with Android OS seeking Spanish payment methods for reporting an illegal streaming case of my favorite series, where and how do I file the complaint directly via email or site?",CONTENT,b5266091
Can you guide me through submitting evidence of copyright misuse seen on my subscription service's 24/7 online content library in English without any external media device to generate a report with your help department?,CONTENT,b5266091
Can you guide me on how to report inappropriate content for a Spanish language program I found on Smart TV?,CONTENT,5acf2e5c
"@support@example.com - How do I submit what seems like an unfair translation of my documentary series via YouTube within our community guidelines while using PayPal or credit card, also referencing the Copyright Policy when needed to report a potential copyright infringement issue on Smart TVs?",CONTENT,5acf2e5c
"What's step 2 for filing an unfit content complaint concerning my son-in-law's documentary series watched through his new Bravia TV at our house, requiring the use of translation reasons and respectful tone to make a report as per your guidelines?",CONTENT,5acf2e5c
"Could you kindly explain how I might fill out an online form on Support.example.com using my mobile device in Spanish when needing urgent moderation for content directly observed at our dinner table, considering copyright implications and seeking further clarity about reaching Customer Service via email support@example.com?",CONTENT,5acf2e5c
"Got it! Can you break down how to swiftly lodge a formal grievance on the Media Domain Support site by pressing 'Submit' after thoroughly detailing my son-in-law’s series screened live during our family gather at smart TV, with immediate attention from your copyright team for possible rights breaches?",CONTENT,5acf2e5c
Could you guide me on how to report a copyright infringement for my documentary series that I see online? What information do I need to provide them with regarding the issue at hand before submitting the form as instructed by their guidelines?,CONTENT,cd363238
How do I report inappropriate content on our Smart TV after watching a documentary series played here?,CONTENT,e0b85510
I watched this disturbing program earlier; where can I send feedback or complaints about it to help uphold community standards here at Example.com support?,CONTENT,e0b85510
"What steps should I take if there's something offensive on our platform with respect to the Copyright Policy, using my Spanish language option for guidance?",CONTENT,e0b85510
"Help! There was some content during a show that went against policies; how do I submit this as an inappropriate issue via email or another method listed under 'Contact Us,' possibly PayPal if available and convenient?",CONTENT,e0b85510
Excuse me for asking this to you directly but I've stumbled upon an instance of explicit content on your Smart TV platform during the documentary series in Spanish. Could we swiftly report it?,CONTENT,0537e805
"Hi, there! Quick question – how do I go ahead and let us know about some unsavory material caught up amongst my favorite educational shows aired here recently for me to share with whoever needs this info?",CONTENT,0537e805
"Good day! Pardon the formalness of my tone. As part of ensuring our community remains standards-compliant, I encountered content that may not align ideally within specific programming – how might one facilitate its appropriate reporting on your website for credible examination and action?",CONTENT,0537e805
Where should I report inappropriate content on our platform?,CONTENT,9fc5ad6e
I'm faced with some unsavory content; what steps do I take to submit a complaint here since we use Spanish language preference.,CONTENT,9fc5ad6e
"How exactly can one navigate within the Smart TV app interface of my favorite documentary series for reporting an issue like this, if it breaches copyright policy?",CONTENT,9fc5ad6e
Could you guide me through which payment option - credit card or PayPal – I might need while submitting such a complaint on your website? Seems crucial.,CONTENT,9fc5ad6e
"Once in the 'Contact Us' section of our site for addressing similar content-related grievances, how do I signal that it’s about Copyright Policy infractions specifically?",CONTENT,9fc5ad6e
Hi there! Could you guide me on how to report some explicit content I found during a documentary series watching on my smart TV? Cheers.,CONTENT,25a0bb0b
"When viewing some disturbing material in the program called Documentary XYZ, which device and platform were those scenes shown on, such as Smart Television or streaming box – here https://support.example.com?",CONTENT,25a0bb0b
How can I report a copyright violation on your website for an infringed documentary series?,CONTENT,889c481c
"Could you tell me the steps to submit my claim about faked copyright issues with my favorite Smart TV program shown by your service, including payment details?",CONTENT,889c481c
"I noticed unauthorized use of a film I own, which features content exclusively in Spanish. How do they process such cases according to their policy and what are the next steps for me at this point?",CONTENT,889c481c
I am having trouble submitting a copyright infringement claim on my Smart TV for the 'Mom & Dad's Kids Home Learning Program'. What steps should I take?,CONTENT,bd6dd95d
"Could you guide me on how to report unauthorized copying of episodes from our documentary series through support@example.com, as directed in your guidelines?",CONTENT,bd6dd95d
To whom or where do I notify for help with copyright issues regarding my viewing habits using a device platform like Smart TV?,CONTENT,bd6dd95d
"I need assistance on how to initiate the report of unauthorized replication and broadcast from our documentary series. Can you walk me through it, please?",CONTENT,bd6dd95d
"Is there specific information that I am required to fill when reporting copyright infringement? If yes, what details should be included exactly as per your instructions provided on https://support.example.com/copyright-policy/",CONTENT,bd6dd95d
Could you guide me on how to report inappropriate explicit content on the website?,CONTENT,7d7d8da6
"I need assistance with reporting foul or adult material I found; could you tell me what steps are necessary for this process, please provide a guideline using our platform's 'Contact Us' section and email support?",CONTENT,7d7d8da6
"Can someone explain to me how exactly one should report explicit videos featuring inappropriate content on Smart TV channels available at ""https://support.example.com"" with an emphasis on selecting the correct options while respecting privacy policies, using either credit card or PayPal payment methods if required?",CONTENT,7d7d8da6
"For submitting a complaint about copyright issues involving disturbing documentary series content I encountered online in Spanish, what precise steps should one take after reaching our ""Contact Us"" page as described on support.example.com without disclosing personal information unnecessarily?",CONTENT,7d7d8da6
I came across some adult material that goes against our Content standards during a Streamed TV program; do we have an email or designated button available at Email Option to report this directly through the 'Submit' command after explaining my concerns?,CONTENT,7d7d8da6
Could you guide me on how to report offensive material I found in a documentary series? The details are crucial too.,CONTENT,1b326049
"What is the proper way for someone living abroad with Spanish preferences like myself, using PlayStation devices - TVs specifically, to submit grievances regarding content within shows or documentaries they deem improper here at your site (https://support.example.com)?",CONTENT,1b326049
"I need help getting in touch and voicing concerns over questionable depictions I stumbled upon while watching a popular news program on my smart TV; could you walk me through the reporting process as per our guidelines, perhaps?",CONTENT,1b326049
"Some documentary series footage has content that seems disrespectful or offensive to cultural sensitivities - since it's in Spanish and broadcasted via a Smart TV platform here at https://support.example.com, how do we go about raising these issues using the channels provided?",CONTENT,1b326049
"During my time watching live-stream content on our site through various devices like PC or tablets as well as smart TV platforms that supports multiple languages including Spanish - if I encounter material not aligning with respectful practices within a movie series, how can I initiate this kind of complain process effectively?",CONTENT,1b326049
How can I report a copyright violation involving my documentary series on your Smart TV platform?,CONTENT,ec6545db
"I've observed unaut0bly much content from the 'Mighty Shadowfall Chronicles', is it acceptable to submit this detail for review via email at support@example.com under our Copyright Policy, with details about credit card or PayPal payment as an additional note if necessary?",CONTENT,ec6545db
"Could a user in need of reporting copyright issues on StreamFlix's website begin the process by visiting https://support-streamflix-companysupport.com/ and selecting 'Report Copyright Issue', following it with completing pertinent data like program type, language preference such as Spanish?",CONTENT,ec6545db
"After viewing a copy of my preferred documentary series on an infringing platform rather than ours for download without permission, what steps via email support@example.com should I take next to follow up and report with details about the unauthorized usage within Copyright Policy section?",CONTENT,ec6545db
{'questionText': 'I came across some stuff that seems out of place on your service; where do I let you know?'},CONTENT,02518e44
"{'questionText': ""Could somebody assist me in indicating an improper item or show within the support department's FAQ, and tell them it’d help maintain a good environment for everyone to watch documentaries together?""}",CONTENT,02518e44
{'questionText': 'I need guidance on how I could report that a popular Spanish language program is not complying with your advertised policies; just interested in the process.'},CONTENT,02518e44
"{'questionText': '@media.info Report copyright issue and get details of their TV programming, as it feels misaligned with our standards?'}",CONTENT,02518e44
I've been trying to find out how I should send a credible report about an offending documentary on my Smart TV but the instructions are too technical; can you simplify this process for me by emailing in what steps need to be done? Please ensure using credit card or PayPal as payment method.,CONTENT,02518e44
I saw something offensive on the documentary series section; where and how can I report it?,CONTENT,d6f65e3b
"What's the procedure for taking down inappropriate content related to a Smart TV program through email to help@example.com, using either credit card or PayPal payment methods as directed by your Help Centre FAQ on copyright policy issues within our Contact Us section?",CONTENT,d6f65e3b
"I need assistance reporting this blatant copyright issue with my documentary series content directly from a Smart TV interface; the steps are to click on 'Report Copyright Issue' inside the 'Submit/Submittal' button region, right next to where it says I can report inappropriate material?",CONTENT,d6f65e3b
"Can you guide me through informing our customer service about an issue with copyrighted content being displayed on my Smart TV related documentary series by email at support@example.com as mentioned under the Copyright Policy section of Contents reporting protocols within Contact Us, assuming they accept submission payment done via credit card or PayPal?",CONTENT,d6f65e3b
"To ensure compliance with our respect for copyright policies and to maintain a proper content environment on my Smart TV while watching documentary series programming – might you explain the exact process I should follow through submitting an allegation of inappropriate material, as suggested by clicking 'Report Copyright Issue'",CONTENT,d6f65e3b
How do I report a copyright violation on my Smart TV involving the documentary series?,CONTENT,65ebdd15
"I noticed some content from My Favourite Movie is appearing without proper rights; can you assist with that for Spanish language version accessed through Support@example.com contact form, using crediter or PayPal option available therein to report it instantly and effectively at https://support.example.com?",CONTENT,65ebdd15
"I saw some parts of a documentary series on my television screen which I believe is used without permission; could you guide me step by step through how one would submit this copyright infringement claim for evaluation here, please help!",CONTENT,65ebdd15
Is there an official way to report that someone has violated our copyright policy related to a documentary series on Smart TV? I seek your detailed guidance.,CONTENT,65ebdd15
"When reporting illegal use of content like the Emmy Winner docudrama accessed via Support@example.com link, do we provide credit card or PayPal options for submitting this online form directly at https://support.example.com with ease?",CONTENT,65ebdd15
How can I report explicit content for a documentary series on our Smart TV support page using the Spanish language option?,CONTENT,09d563ca
"What steps do I need to follow if there's some type of copyright policy infringement taking place within an episode of my favorite documentary series here, and which payment method is best for contact forms like these at your end (credit card or PayPal)? Also, what should be mentioned as the reason while reporting?",CONTENT,09d563ca
"I feel uncomfortable because I found some inappropriate material related to our Spanish language option content on Smart TV. How do we report and deal with this issue within a documentary series section using your dedicated team's community standards policies, including submitting via email or contact form?",CONTENT,09d563ca
Could you give me detailed instructions on how exactly I submit an inappropriate material complaint for a specific episode of my Spanish-titled documentary television program we watch here—I need to know about the right sections and buttons.,CONTENT,09d563ca
"If there's explicit content mistakenly made public through copyright issue notice, can you guide me on how exactly this is reported under 'Report Copyright Issue' for viewing episodes in a Spanish channel segment of our Smart TV?",CONTENT,09d563ca
Where can I report explicit content on your platform?,CONTENT,2eaf878a
I wish to submit a complaint about adult material; where should it be directed?,CONTENT,2eaf878a
"Could you explain how I can notify the appropriate team if they posted something inappropriate here, specifically during our documentary series nightly showings and my preference for reporting issues also in Spanish language settings on Smart TV?",CONTENT,2eaf878a
"{'casualInquiry': ""Hey there! Got a minute? I noticed something off here and wanna let Y'all know by submitting what looks like some dodgy content. How do we go about it?""}",CONTENT,a0fe07bf
"{'formalRequest': 'How does one initiate the process for reporting potentially inappropriate material observed on this platform pertaining to a documentary series available exclusively through our Smart TV channels, using Spanish language settings while also considering credit card or PayPal payment methods?'}",CONTENT,a0fe07bf
"{'directInstruction': ""What specific steps should I take if there's copyrighted stuff related to my complaint about what seems like rule-breaking content in a documentary series on your platform?""}",CONTENT,a0fe07bf
"{'userAssistance': 'I came across some material that doesn’t seem right while changing channels. Can someone help me report this, and maybe explain I should be including when reporting for Spanish language documents how to also get my credit card info charged? Got it?'}",CONTENT,a0fe07bf
{'conciseQueries': 'Needed a quick guide on submitting content notices: specific steps via dropdowns & email support contact details!'},CONTENT,a0fe07bf
I stumbled upon a potential copyright issue on the Smart TV with my favorite documentary series; how do I report it?,CONTENT,e5a31eac
"It seems like someone is misusing our 'Green Planet' docuseries by distributing unauthorized copies on their smart devices, what steps should they take to formally submit such reports exactly as detailed in your procedures?",CONTENT,e5a31eac
"I encountered a copyright violation involving the documentary series about ocean conservation—how can I accurately report this using my credit card or PayPal without direct copying from sources like yours and while ensuring that all necessary details concerning language are considered, with guidance to follow specific website sections as per your response?",CONTENT,e5a31eac
"In terms of formally notifying you guys for copyright infringement on a documentary series I've seen online on my Smart TV, what precise process do they need to adhere to involving submission via the Copyright Policy section and payment through either credit card or PayPal as per your policies?",CONTENT,e5a31eac
"For someone viewing the 'Jungle Depths' docuseries primarily in Spanish across various smart screens who spots copyright misuse, what would be their exact steps for a proper complaint submission via support@example.com and where on the site should it originate from according to your detailed FAQ?",CONTENT,e5a31eac
I just watched a show on your platform and it contained explicit images I wasn't comfortable with; can you tell me how to report this?,CONTENT,91c3f377
"Could someone please assist me in submitting a complaint about objectionable content that appears next to the documentary series my kids watch? How does one do so effectively through https://support.example.com, as per our company's copyright policy?",CONTENT,91c3f377
How do I report a copyright issue on my Smart TV?,CONTENT,d9a81cb6
I own the rights to this documentary series and need help reporting unaut0rmedous usage; where should I start within your Contact Us section?,CONTENT,d9a81cb6
"What's the process for taking action against someone using my show without permission in Spanish via email support at ExampleCorp.com, with payment details as credit card or PayPal when submitting reports on copyright issues under Copyright Policy overview?",CONTENT,d9a81cb6
How can I formally report a copyright infringement on my Smart TV involving the documentary series that's being played without proper authorization?,CONTENT,9ba8ea26
"Could you guide me through reporting unauthorized broadcast of 'documentary series' featuring characters named after historical events here, step by step please? It needs to be Spanish.",CONTENT,9ba8ea26
I need help on how I can submit a copyright report form for my TV. Can someone show me the process specifically for documentaries using SmartTVs and in Spanish language options available on your site?,CONTENT,9ba8ea26
How do I report content on a Smart TV that is showing inappropriate advertising related to this documentary series? The ads are only available in Spanish.,CONTENT,07f2980a
"I recently watched an episode of the docu-reality show and found its portrayal racially biased. Can you guide me through reporting such sensitive content on our service for review at your support channel, 'Contact Us' email: support@example.com?",CONTENT,07f2980a
"A documentary I invested in was aired without my consent by the creator, showing material they claimed is their copyright property—how do we correct this from within Smart TV devices that offer content access through our website at https://support.example.com with language preferences including Spanish?",CONTENT,07f2980a
