question,category,id
I suspect my copyright was violated on your platform; what do I need to know about reporting it?,CONTENT,34b742ae
"Could you explain the process for filing a report against unfair use or reproduction of 'Flipping History', please, as per our Spanish guidelines?",CONTENT,34b742ae
For someone with limited tech skills watching their documentary series on Smart TV via example.com's services being infringed upon - what steps should they follow to report this offense for justice under your policies?,CONTENT,34b742ae
"I need the procedure written out, from start till end – how does one convey a claim of copyright abuse while using their smart television at home when it comes to documentaries on 'History Uncovered' series provided by you? Please specify for credit card or PayPal transactions.",CONTENT,34b742ae
How can we submit our detailed content violation account regarding the use in my living room against your guidelines through that email contact form?,CONTENT,34b742ae
"Can someone help me report a copyright infringement on my Smart TV about the documentary series I believe was used without permission? How do I start this process from your site's homepage for Spanish speakers, which usually requires selecting payment methods. Thanks.",CONTENT,804f1a37
'Tengo que informar una posible infracciones de derechos de autor con respecto a un programa especializado en mi Smart TV acerca del documental serie para lo cual creí no se tiene el permiso por parte de la gente. ¿Cómo puedo hacer esto desde tu página principal si yo hablo español y necesito usar métodos de pago como tarjetas de crédito o PayPal antes? Gracias.,CONTENT,804f1a37
"I've spotted something on my Smart TV that was a documentary series without rights. How do I report copyright infringement, starting from your homepage for Spanish users who may want to process through credit card or PayPal options before submitting their complaint? Gracias.",CONTENT,804f1a37
"I stumbled upon an illegal usage of my favorite film's series on a Smart TV screen. What steps should I follow as per the response found, initiating from your main site for those who communicate in Spanish and possibly want to know about payment methods like credit card or PayPal before submitting their complaint? Gracias.",CONTENT,804f1a37
"I just discovered my documentary series being played on a Smart TV which might be because of copyright violation. What are the detailed steps I need to follow as per your help guide, starting from accessing your page for Spanish speakers and dealing with payment methods like credit card or PayPal before finally submitting an infringement report? Gracias.",CONTENT,804f1a37
I've come across some explicit content that'm not suitable for viewers; how should I report this?,CONTENT,0d964243
"What steps are there to take if the adult material becomes too overwhelming on my Smart TV screen during a documentary series in Spanish language, and which payment method can be used when reporting as per Copyright Policy?",CONTENT,0d964243
"I found explicit footage that violates our device platform standards while watching programming; where should I click to report this issue accurately for credit card or PayPal repayment procedures according to the FAQ guidance provided by support@example.com contact method in a formal manner, please include any vital details expected as part of your submission?",CONTENT,0d964243
"While engaged with documentary content on Smart TV and encountering potentially offensive material, I wish for an informal inquiry: could you just let me know the steps to bring this up directly using contact us protocol without going into financial specifics or sensitive personal information?",CONTENT,0d964243
Where can I report this copyright issue on your website?,CONTENT,ef3aab6e
I need to complain about a movie streaming service copying content illegally. How do you want me to proceed according to the FAQs?,CONTENT,ef3aab6e
"My neighbor has been broadcasting my documentary series without permission, which clearly violates copyright laws as per our policies - what should I fill out on your site and who'll look into this issue afterward, based on guidance from provided resources?",CONTENT,ef3aab6e
"Gentle inquiry: Could you please guide me where to report a serious breach of content rights infringements involving the broadcasts on my Smart TV, referencing step-by09 - I seek your assistance following outlined protocol for copyright matters.",CONTENT,ef3aab6e
"I'm noticing illegal use of documentaries series. To what button do I click to send an email about this matter based directly from FAQ instruction 'Submit the report', while acknowledging my preference for content being in Spanish?",CONTENT,ef3aab6e
I'm noticing copyrighted content on my Smart TV and want to report it through your official site. Could you steer me in the right direction?,CONTENT,e0c30c5f
"Could you assist a user from reporting alleged unauthorized replication of documentary footage found while watching their series online, as provided at https://support.example.com/?reportcopyrightinfringement=help+me&languageoption=Spanish and payment can be made using my credit card or PayPal?",CONTENT,e0c30c5f
"What formal steps must I take to report foul play of copyright infringer on your platform for a documentary series, especially when dealing with multilingual support options mentioned at https://support.example.com/?reportcopyrightinfringement=help+me&languageoption=Spanish?",CONTENT,e0c30c5f
"I require the immediate action steps to forward evidence of an illegal reproduction case I spotted during a Spanish broadcast from your platform dedicated for my Smart TV, can you point me at exactly how and where on https://support.example.com/ must one access this info as provided in their report copyright issue section?",CONTENT,e0c30c5f
"Could someone direct assistance to get through with the submission of an alleged copyright violation involving a particular documentary for those who opt Spain's language option while following your standard reporting mechanism, which is highlighted by filling out specific details and pushing submit at https://support.example.com/?",CONTENT,e0c30c5f
Where should I report inappropriate content on the Smart TV platform within a Spanish documentary series?,CONTENT,0375acf7
"I need to let you know about some offensive material during my watch of a program, who can assist me with this issue using their reporting tool or link that leads directly there – what are those options provided by your contact support guidelines for viewers seeking help in navigating the website'neraulica.com?",CONTENT,0375acf7
"Steven wants to notify you about something he believes goes against copyright policy during his evening with a program on TV, specifically when watching an episode of 'Ultimate Fossils.' How would one navigate your reporting system efficiently from their television screen – any icons or prompts that steer them towards completing the report?",CONTENT,0375acf7
Could you guide me on how to report a copyright infringement for the documentary series I found online?,CONTENT,1e8e5b9a
I need assistance with reporting potential copyright violations. How do I contact someone using the website 'https://support.example.com'?,CONTENT,1e8e5b9a
"Someone is sharing my film without permission, what are the steps to report this on your site in English and via email at support@example.com for further help?",CONTENT,1e8e5b9a
"It feels like there might be some pirated episodes of my show 'Global Voyage HD', how do I formally alert using PayPal or credit card details through the Copyright Policy section online, correct?",CONTENT,1e8e5b9a
Where can I submit a report about inappropriate content on the Smart TV platform?,CONTENT,29001295
"I watched an explicit movie on your service. How do I properly flag it as offensive material to comply with our community standards, using my Spanish-speaking preference?",CONTENT,29001295
Can someone please guide me through reporting a copyright issue involving unauthorized use of the documentary series 'Planet Explorers' in accordance with your Copyright Policy on example.com?,CONTENT,29001295
"I found some adult content that has nothing to do with my kids watching channel, what steps should I follow within our website support system?",CONTENT,29001295
Help me understand how and where exactly one can report copyright concerns related to program material displayed in Spanish language.,CONTENT,29001295
Hey there! I stumbled upon some not-so-nice content on our Smart TVs and wanna let you guys know. Where do we send a report about this? Just pointing out: https://support.example.com is where it's at.,CONTENT,ed546a3b
"Good day, Excusez mavié en Français to my inquiry that on your platform displaying documentaries in Spanish I came across content which seemed not fit for kids and wished know how can report this? Please advise. Thank you support@example.com as address.",CONTENT,ed546a3b
"If someone's watching a certain documentary series and finds something objectionable to their cultural norms, what should one do next after reaching https://support.example.com on the website with that intention in mind?",CONTENT,ed546a3b
"Could anyone clarify for me once again at this point—post reporting via contact us form located near content flag icon; if a credit card or PayPal as payment details would suffice, it is advisable to include such information along submission right?: A detailed input.",CONTENT,ed546a3b
"{'question': ""Hey there! I think someone's selling a copyrighted documentary series on my Smart TV. Can you tell me how to report this?""}",CONTENT,9177cec5
"{'question': ""Could you guide me through the steps of reporting a potential violation involving the airing of 'La Historia Inamovible,' I believe it's under copyright laws, via your support website at https://support.example.com?""}",CONTENT,9177cec5
"{'question': ""I spotted an unauthorized documentary series playing on my Smart TV in Spanish—what action should i take to report this correctly according to the policies from Copyright Policy section for a program like 'La Vida de los Ecos,' and can you provide detailed instructions?""}",CONTENT,9177cec5
"{'question': 'What are the recommended payment methods I could use when submitting an infringement complaint using your official site, possibly through PayPal or credit card details? And where exactly should my report go to start this process for a documentary series on TVs?'}",CONTENT,9177cec5
"{'question': ""To lodge allegations about copyright misuse against broadcast television's 'Documentos Revelados,' and initiate our formal investigation protocol, what would be the most appropriate button I need to click at https://support.example.com/Contact-Us?""}",CONTENT,9177cec5
"Can I report explicit content on a Smart TV from the documentary series in Spanish to our support team at https://support.example.com using my credit card or PayPal? Also, will you help me understand if there's an issue with copyright policy too and what details should I mention for Copyright Issue reporting?",CONTENT,64414782
"I found some adult material on the documentary series streamed in Spanish via Smart TV to be not appropriate. How do I report this using https://support.example.com, ensuring that my claims are within our copyright policies by choosing Report Copyright Issue as an option and indicating all required information for a thorough review?",CONTENT,64414782
I've spotted some explicit content while watching the documentary series in Spanish on my Smart TV – what course of action can I take to report this through https://support.example.com so that it gets examined according to our Copyright Policy?,CONTENT,64414782
How can I report an infringement of copyright on my Smart TV using Spanish?,CONTENT,15527cf6
"Could you guide me through submitting a copyright violation for the 'documentary series' that was streamed illegally to my TV screen? Preferably, instructions might be given via credit card or PayPal.",CONTENT,15527cf6
I need some assistance. I wish to alert media of possible piracy involving recent episodes viewed on my Smart Telvision since I couldn't pay for it; where should this report go and who would receive an email confirmation at support@example.com?,CONTENT,15527cf6
"As a viewer experiencing copyright issues with their TV, what is the formal method to submit reports about 'streaming documentaries illegally hosted on sites not compliant with our policies' directly into Copyright Policy section of your company website for proper action in Spanish?",CONTENT,15527cf6
"When I notice content that doesn't seem right on your platform, particularly episodes in a Spanish-language documentary series for my Smart TV, where should I report the problem?",CONTENT,855e5f67
I found some explicit scenes within an adult entertainment program while watching through our streaming service. How do we lodge such reports properly via this website to support content standards?,CONTENT,855e5f67
"As someone who uses your services on a Spanish-language setting for Smart TV, could you guide me step by step in reporting any offensive material directly related to copyright policies I've come across within the documentary series sections of videos or live events?",CONTENT,855e5f67
"I encountered something sensitive while viewing content online. It seems like it goes beyond just adult humor and touches on themes that seem not compliant with our culture here in Mexico, where we abide by strict community guidelines via this site for Smart TV users such as myself.",CONTENT,855e5f67
"If I see a video or episode of the documentary series displayed incorrectly due to bad translation instead being labeled under Copyright Policy concerns on my Spanish language viewing platform linked with our streaming service, how do we start reporting this copyright infringement matter correctly?",CONTENT,855e5f67
I came across a documentary series available on my Smart TV that I suspect is copyright infringement - how can our team assist me?,CONTENT,2891fdc7
"Your Content policies are clear but not easy to digest sometimes. Could you explain the process of reporting illegally shared copies within your network, perhaps using an example for a documentary series on my Smart TV device that's available only in Spanish language content which I cannot legally access or download?",CONTENT,2891fdc7
"I need help reporting copyright issues regarding specific shows and movies. Can you guide me through the protocol here at {{support@example.com}} especially with regards to those unautondocumentary series shared across my Smart TV that is not available in Spanish but somehow present there, suggesting an oversight I wish to correct?",CONTENT,2891fdc7
"My friends find it funny seeing movies they shouldn't on their smart TV screen and want your help stopping them. If a documentary isn’t even showing as original Spanish content here at support@example.com from {{webinfo1}}, what steps do we follow for these sorts of copyright concerns, keeping the user-friendly option in mind?",CONTENT,2891fdc7
I've seen something inappropriate on the documentary series I was watching with my Smart TV; how do I send a notification?,CONTENT,1c60b4fa
"Could you explain to me like we’re old colleagues over coffee, the process of signaling your team about objectionable content here at support.example.com for something as specific as an offensive documentary series episode on television screenings in Spanish language format via PayPal or credit card?",CONTENT,1c60b4fa
"My cousin and I came across some adult content while we were browsing through the credits of a TV show streaming service, what should be our next steps according to their policy about copyright issues at support.example.com where you report such problems? And would it make sense from your side too since this is in Spanish language that they offer?",CONTENT,1c60b4fa
"As an aged film buff who just bumped into blatantly clear hate speech during a streaming marathon, I need to ensure the platform we're using at support.example.com takes stern measures against such vile content based on their Copyright Policy guidelance while offering options for payment through PayPal or credit card.",CONTENT,1c60b4fa
"Got an eye-opening moment here with our local TV channel that seems way out of line regarding the current shows, could you run down at support.example.com just how I'd report this using their Contact Us method when choosing between sending in my Visa card info via PayPal or straight to them because they have a detailed Copyright section and all?",CONTENT,1c60b4fa
I'm concerned because I saw some inappropriate material on my Smart TV during a documentary series; where can I report this?,CONTENT,5f12ec10
How do I formally get back to you regarding the disturbing content found within certain programs available only in Spanish?,CONTENT,5f12ec10
"Could someone assist me in filing an official complaint about offensive scenes displayed that go against our Copyright Policy, and what steps are needed for such a report via email or web form submission with either credit card or PayPal payment options included?",CONTENT,5f12ec10
I'm upset because I saw some adult content on the Smart TV while watching a documentary—how do we report this as inappropriate?,CONTENT,801a2f21
"Can someone explain to me how exactly one should file and escalate grievances regarding non-family-friendly material that popped up during my view of certain programs for children aged content on our platform, please provide the official procedure at https://support.example.com.",CONTENT,801a2f21
I stumbled upon some foul language in videos designed to be watched by younger kids between episodes—what are your recommended channels and protocols when I need assistance with this?,CONTENT,801a2f21
"When there's content that is way too graphic for youngsters on platforms targeted at them, like during my watch of historical series, what steps should we follow strictly from our site to handle these complaints effectively using credit card or PayPal payments while addressing copyright issues simultaneously?",CONTENT,801a2f21
How do I report a copyright issue on the Smart TV documentary series? Could you guide me through it using our website's official procedure in Spanish or can we contact customer service directly via email support@example.com for assistance with this matter?,CONTENT,d35afc44
"Hi, my name is John Doe and recently encountered that one-hour old copyright violation on the documentary series 'History Unscripted.' I found your report option but unsure where to fill it out correctly.",CONTENT,d35afc44
"I noticed a recent stream of an episode from our popular Smart TV show has been unlawfully distributed. Is there, indeed, some way or function through which viewers like me can inform you about copyright breaches effectively?",CONTENT,d35afc44
"What's the best action for someone to take if they see unaut07re distributing episodes of 'The Adventures of Knowledge Network' on their Smart TV—are there official steps we must follow according to our content policies, and could guidance be sent out by email or a direct link found somewhere in your help sections?",CONTENT,d35afc44
"Could somebody enlighten me as how exactly I can formally raise an alarm about copyright issues within the 'Global Warming Today' series on my Smart TV without getting into technical difficulties - are there specific forms filled online with details, and does support@example.com provide a rapid response or is it better to use alternative methods like calling directly?",CONTENT,d35afc44
"{'question': ""I'm using my Smart TV to watch this documentary series in Spanish and it seems like I have a copyright issue. How do I officially report them?""}",CONTENT,acf12377
"{'question': ""What steps should I follow if someone is making unauts fair use claims on their content, which they say hasn't been copied from anywhere? Could you guide me through the process of filing such a copyright infringement complaint please.""}",CONTENT,acf12377
{'question': 'Can my Spanish-speaking friends easily report that someone is illegally sharing videos on their Smart TV by visiting your Contact Us page?'},CONTENT,acf12377
"{'question': 'If I want to submit a formal complaint about the unauthorized use of my documentary series watched here, what information do you need from me and where can they go for filing it on site?'}",CONTENT,acf12377
"{'question': ""I found this 'Report Copyright Issue' option under your Smart TV copyright policy; how does that process work? I want to start by reporting something seen today.""}",CONTENT,acf12377
I'm feeling upset because someone is using my copyrighted documentary series on their Smart TV without permission. How do I report this infringement?,CONTENT,8b0e2c62
Can you guide me through the process of notifying our customer service about a credit card dispute via email at support@example.com?,CONTENT,8b0e2c62
"I witnessed some sort of copyright breach related to my Spanish language documentary series on Smart TV, how should I proceed with filing such as report using this platform's Copyright Policy section in English or other supported languages?",CONTENT,8b0e2c62
What are the steps needed if someone has replicated part of a film that we own rights for and broadcasted it via our smart devices? Are there forms to fill out on your website?,CONTENT,8b0e2c62
"I saw unauthorized content featuring my documentarian work across various platforms, even after I used different payment methods. How do I formally report copyright infringement through this company's system?",CONTENT,8b0e2c62
How do I report a copyright infringement that involves my favorite documentary series on our platform?,CONTENT,60620b1b
I accidentally stumbled upon an unauthorized replication of the latest 'Telling Truths' show - is there some way to formally notify about this via smart TV support system available at example.com/support for copyright violations?,CONTENT,60620b1b
"Could you guide me, with regards in mind towards my interests which include award-winning documentary series and historical footages respecting languages like Spanish, on how I can submit a formal complaint regarding pirated content found during streaming sessions via the platform at example.com/support or support@example.com?",CONTENT,60620b1b
I seem to have landed across copyright infringement while browsing our services for documentary series; could you assist me with navigating through this problematic encounter by pointing towards steps on how I am expected to submit a legitimate complaint following your company’s established methods and regulations online?,CONTENT,60620b1b
"As someone who is deeply invested in the ethical consumption of media and regularly uses services for platforms holding documentaries, could you clarify if there're particular guidelines or actions required upon encountering copyrighted content being distributed illegitimately within our system?",CONTENT,60620b1b
I want to let the team know about a possible copyright issue on my Smart TV by watching your documentary series.,CONTENT,a2693afb
How can I report an infringement of rights for 'Through My Screen Eyes'?,CONTENT,a2693afb
"Steve noticed some unauthorized use of his shows here; could you guide him through how to file a copyright complaint on the website, assuming he speaks Spanish and prefers using PayPal or credit card as alternatives payment modes just in case they ask for it somewhere.",CONTENT,a2693afb
For those experiencing an unlawful broadcast of my documentary series by another smart TV owner near me - could you explain how to initiate this process on example.com (support link) right away?,CONTENT,a2693afb
"I need a step-by-step procedure laid out in simple terms, so I can report these copyright violations without any hassle.",CONTENT,a2693afb
Can someone guide me on how to report a copyright infringement that I spotted while watching this documentary series from my Smart TV? The program wasn't mine.,CONTENT,9147c9fe
"I need assistance with reporting somebody for using copyrighted material without permission. This involves an episode of the same show which has been pirated on various devices, not limited to my own smart equipment at home. What steps should I follow exactly?",CONTENT,9147c9fe
You know what grinds my gears when someone exploits content illegally right under people's noses! So here’s this copyright violation case involving the TV series documentary thing I bought and want back to respecting its rules.,CONTENT,9147c9fe
"I caught a blatant infringement of copyright. It was one segment from our favorite docuseries that seemed everywhere on Smart Devices, no matter what language settings we have set, including Spanish options! How do we tackle this mishap?",CONTENT,9147c9fe
"Hey, could you inform me about the proper way to officially report a documentary series I own being used without authorization here at {support@example.com} and on various smart devices in different languages?",CONTENT,9147c9fe
How do I report a copyright infringement on our platform?,CONTENT,a81169ec
Could you guide me through the process of reporting unautze d violation to this service center please?,CONTENT,a81169ec
What steps are involved in filing an official complaint about content copying here?,CONTENT,a81169ec
"Do we have procedures for addressing copyright abuses and how can I initiate it on a Smart TV regarding my documentary series, only using payment via credit card or PayPal.",CONTENT,a81169ec
I saw some parts of our program that were copied elsewhere. What is the protocol to formally lodge such accusations?,CONTENT,a81169ec
How do I report bad content on my Smart TV screen during a documentary series in Spanish?,CONTENT,a70eb079
